[
  {
    "nom": "Attestation SecNumacadémie",
    "organisme": "ANSSI",
    "niveau": 1,
    "voie": "Généraliste",
    "format": "QCM",
    "cout": "Gratuit",
    "quand": "Tout de suite : officielle, rapide, une ligne de CV dès la 1re année.",
    "lien": "https://cyber.gouv.fr/le-mooc-secnumacademie"
  },
  {
    "nom": "Badges Cisco (Intro to Cybersecurity)",
    "organisme": "Cisco NetAcad",
    "niveau": 1,
    "voie": "Généraliste",
    "format": "QCM",
    "cout": "Gratuit",
    "quand": "En parallèle de la 1re année, pour les bases réseau.",
    "lien": "https://www.netacad.com"
  },
  {
    "nom": "TryHackMe SAL1",
    "organisme": "TryHackMe",
    "niveau": 2,
    "voie": "Défensif",
    "format": "Pratique",
    "cout": "€",
    "quand": "Voie blue team, après 6 mois de pratique régulière.",
    "lien": "https://tryhackme.com/certification/security-analyst-level-1"
  },
  {
    "nom": "eJPT",
    "organisme": "INE",
    "niveau": 2,
    "voie": "Offensif",
    "format": "Pratique",
    "cout": "€",
    "quand": "Voie pentest, après 6 mois de pratique. Bon premier examen pratique.",
    "lien": "https://ine.com"
  },
  {
    "nom": "CompTIA Security+",
    "organisme": "CompTIA",
    "niveau": 2,
    "voie": "Généraliste",
    "format": "Mixte",
    "cout": "€€",
    "quand": "Valider la théorie, fin de 2e ou 3e année. Professor Messer suffit pour réviser.",
    "lien": "https://www.comptia.org"
  },
  {
    "nom": "HTB CPTS",
    "organisme": "Hack The Box",
    "niveau": 3,
    "voie": "Offensif",
    "format": "Pratique",
    "cout": "€€",
    "quand": "Après l'eJPT et un an de pratique. Long et exigeant.",
    "lien": "https://academy.hackthebox.com"
  },
  {
    "nom": "OSCP+",
    "organisme": "OffSec",
    "niveau": 3,
    "voie": "Offensif",
    "format": "Pratique",
    "cout": "€€€",
    "quand": "La référence des recruteurs en pentest, idéalement financée en alternance.",
    "lien": "https://www.offsec.com/courses/pen-200/"
  },
  {
    "nom": "ISO 27001 Lead Implementer",
    "organisme": "PECB, LSTI…",
    "niveau": 3,
    "voie": "Gouvernance",
    "format": "QCM",
    "cout": "€€€",
    "quand": "Voie GRC, souvent financée par l'entreprise.",
    "lien": ""
  },
  {
    "nom": "CISSP",
    "organisme": "ISC2",
    "niveau": 4,
    "voie": "Gouvernance",
    "format": "QCM",
    "cout": "€€€",
    "quand": "Plus tard : 5 ans d'expérience requis. Pour architecte et RSSI.",
    "lien": "https://www.isc2.org/certifications/cissp"
  }
]
